{
  "$schema": "http://json-schema.org/draft-07/schema#",
  "title": "MadaSymphonyMessage",
  "description": "Envelope for Mada Symphony spawn. Isolation fields drive spawn; they are not costume. protocol / message_type / sidechain / agent_id are refused.",
  "type": "object",
  "additionalProperties": false,
  "required": ["movement", "sender", "cue", "ground_bass_ref", "payload"],
  "properties": {
    "movement": {
      "type": "string",
      "description": "Current movement name, e.g., 'I. Overture', 'II. Variation', 'III. Counterpoint'"
    },
    "sender": {
      "type": "object",
      "additionalProperties": false,
      "required": ["section", "model"],
      "properties": {
        "section": {
          "type": "string",
          "enum": ["conductor", "oboe", "violin_1", "violin_2", "viola", "cello", "contrabass", "horn", "flute", "organ", "heavy_brass", "snare_drum", "cymbals", "harp", "bassoon", "trumpet"]
        },
        "model": { "type": "string" }
      }
    },
    "recipient": {
      "type": "object",
      "additionalProperties": false,
      "properties": {
        "section": { "type": "string" }
      }
    },
    "cue": {
      "type": "string",
      "description": "Event or motive triggering this communication (e.g., SPEC_LOCKED, PATCH_READY, TEST_FAILED)"
    },
    "ground_bass_ref": {
      "type": "string",
      "description": "Reference to immutable spec/contract, e.g., 'SPEC.md#v1.0' or commit hash"
    },
    "isolation": {
      "type": "string",
      "enum": ["worktree", "shared"],
      "default": "shared",
      "description": "worktree = hermes chat -w (Subject/Horn writers). shared = Violin II / Snare on the sounding tree. delegate_task isolates context only."
    },
    "allowed_toolsets": {
      "type": "array",
      "items": { "type": "string" },
      "description": "Heteronomous Tacet: spawn with -t matching this list. Empty = no tools. A Tacet chair must not receive file write or terminal."
    },
    "tacet_paths": {
      "type": "array",
      "items": { "type": "string" },
      "description": "Ground-bass paths this chair must not write (SPEC.md, contracts, locked tests)."
    },
    "budget": {
      "type": "object",
      "additionalProperties": false,
      "properties": {
        "dynamic_mark": { "type": "string", "enum": ["ppp", "pp", "p", "mp", "mf", "f", "ff", "ffff"] },
        "max_tokens": { "type": "integer" },
        "timeout_sec": { "type": "integer" }
      }
    },
    "payload": {
      "type": "object",
      "additionalProperties": false,
      "description": "Concrete deliverable or event payload",
      "properties": {
        "summary": { "type": "string" },
        "artifacts": {
          "type": "array",
          "items": {
            "type": "object",
            "additionalProperties": false,
            "required": ["type", "path_or_uri"],
            "properties": {
              "type": { "type": "string", "enum": ["spec", "patch", "test_report", "ast_diff", "metric"] },
              "path_or_uri": { "type": "string" },
              "content": { "type": "string" }
            }
          }
        },
        "adversarial_points": {
          "type": "array",
          "items": { "type": "string" }
        }
      }
    }
  }
}
