{
  "movement": "III. Counterpoint",
  "sender": {
    "section": "violin_2",
    "model": "gemini-3.7-flash-high"
  },
  "cue": "PATCH_READY",
  "ground_bass_ref": "SPEC.md#v1",
  "isolation": "shared",
  "allowed_toolsets": ["terminal", "file"],
  "tacet_paths": ["SPEC.md"],
  "budget": {
    "dynamic_mark": "mp",
    "max_tokens": 16000
  },
  "payload": {
    "summary": "Review the sounding tree. Findings only. Do not rewrite the ground bass."
  }
}
